{
  "name": "Fate",
  "sagas": [
    {
      "id": "saga-stay-night",
      "name": "Fate/stay night Routen-Ära",
      "tone": "arc-1"
    },
    {
      "id": "saga-zero",
      "name": "Vierter Heiliger Gralkrieg (Fate/Zero)",
      "tone": "arc-2"
    },
    {
      "id": "saga-prototype",
      "name": "Fate/Prototype Universum",
      "tone": "neutral"
    },
    {
      "id": "saga-kaleid-parallel",
      "name": "Kaleid-Parallelwelt (Prisma Illya)",
      "tone": "arc-1"
    },
    {
      "id": "saga-apocrypha",
      "name": "Großer Gralkrieg (Apocrypha)",
      "tone": "neutral"
    },
    {
      "id": "saga-grand-order-babylonia",
      "name": "Grand Order: Singularitäten",
      "tone": "arc-3"
    },
    {
      "id": "saga-grand-order-lostbelt",
      "name": "Grand Order / Cosmos in the Lostbelt",
      "tone": "arc-3"
    },
    {
      "id": "saga-fifth-war",
      "name": "Nach dem fünften Gralkrieg",
      "tone": "neutral"
    }
  ],
  "works": [
    {
      "slug": "fate-stay-night-2006",
      "title": "Fate/stay night",
      "short": "stay night",
      "kind": "serie",
      "released": "2006-01-07",
      "chronology": 30,
      "sagaId": "saga-stay-night",
      "required": true,
      "unit": "Folge",
      "range": [
        1,
        24
      ]
    },
    {
      "slug": "fate-zero",
      "title": "Fate/Zero",
      "short": "Zero",
      "kind": "serie",
      "released": "2011-10-01",
      "chronology": 20,
      "sagaId": "saga-zero",
      "required": true,
      "unit": "Folge",
      "range": [
        1,
        25
      ]
    },
    {
      "slug": "fate-prototype",
      "title": "Fate/Prototype",
      "short": "Prototype",
      "kind": "film",
      "released": "2011-12-31",
      "chronology": 10,
      "sagaId": "saga-prototype",
      "required": false,
      "unit": "Min.",
      "range": [
        0,
        12
      ]
    },
    {
      "slug": "fate-kaleid-liner-prisma-illya",
      "title": "Fate/kaleid liner PRISMA☆ILLYA",
      "short": "Prisma Illya",
      "kind": "serie",
      "released": "2013-07-13",
      "chronology": 90,
      "sagaId": "saga-kaleid-parallel",
      "required": true,
      "unit": "Folge",
      "range": [
        1,
        10
      ]
    },
    {
      "slug": "fate-stay-night-unlimited-blade-works",
      "title": "Fate/stay night: Unlimited Blade Works",
      "short": "UBW",
      "kind": "serie",
      "released": "2014-10-04",
      "chronology": 40,
      "sagaId": "saga-stay-night",
      "required": true,
      "unit": "Folge",
      "range": [
        1,
        25
      ]
    },
    {
      "slug": "fate-apocrypha",
      "title": "Fate/Apocrypha",
      "short": "Apocrypha",
      "kind": "serie",
      "released": "2017-07-02",
      "chronology": 110,
      "sagaId": "saga-apocrypha",
      "required": true,
      "unit": "Folge",
      "range": [
        1,
        25
      ]
    },
    {
      "slug": "fate-kaleid-liner-prisma-illya-oath-under-snow",
      "title": "Fate/kaleid liner PRISMA ILLYA: Oath Under Snow",
      "short": "Prisma Movie 1",
      "kind": "film",
      "released": "2017-08-26",
      "chronology": 100,
      "sagaId": "saga-kaleid-parallel",
      "required": false,
      "unit": "Min.",
      "range": [
        0,
        90
      ]
    },
    {
      "slug": "fate-heavens-feel-1-presage-flower",
      "title": "Fate/stay night: Heaven's Feel I. presage flower",
      "short": "Heaven's Feel I",
      "kind": "film",
      "released": "2017-10-14",
      "chronology": 50,
      "sagaId": "saga-stay-night",
      "required": true,
      "unit": "Min.",
      "range": [
        0,
        120
      ]
    },
    {
      "slug": "fate-grand-order-moonlight-lostroom",
      "title": "Fate/Grand Order -MOONLIGHT/LOSTROOM-",
      "short": "Lostroom OVA",
      "kind": "film",
      "released": "2017-12-31",
      "chronology": 120,
      "sagaId": "saga-grand-order-lostbelt",
      "required": true,
      "unit": "Min.",
      "range": [
        0,
        32
      ]
    },
    {
      "slug": "todays-menu-for-the-emiya-family",
      "title": "Today's Menu for the Emiya Family",
      "short": "Emiya Gohan",
      "kind": "serie",
      "released": "2018-01-25",
      "chronology": 80,
      "sagaId": "saga-fifth-war",
      "required": false,
      "unit": "Folge",
      "range": [
        1,
        13
      ]
    },
    {
      "slug": "fate-heavens-feel-2-lost-butterfly",
      "title": "Fate/stay night: Heaven's Feel II. lost butterfly",
      "short": "Heaven's Feel II",
      "kind": "film",
      "released": "2019-01-12",
      "chronology": 60,
      "sagaId": "saga-stay-night",
      "required": true,
      "unit": "Min.",
      "range": [
        0,
        117
      ]
    },
    {
      "slug": "fate-grand-order-babylonia",
      "title": "Fate/Grand Order -Absolute Demonic Front: Babylonia-",
      "short": "Babylonia",
      "kind": "serie",
      "released": "2019-10-05",
      "chronology": 140,
      "sagaId": "saga-grand-order-babylonia",
      "required": true,
      "unit": "Folge",
      "range": [
        1,
        21
      ]
    },
    {
      "slug": "fate-heavens-feel-3-spring-song",
      "title": "Fate/stay night: Heaven's Feel III. spring song",
      "short": "Heaven's Feel III",
      "kind": "film",
      "released": "2020-08-15",
      "chronology": 70,
      "sagaId": "saga-stay-night",
      "required": true,
      "unit": "Min.",
      "range": [
        0,
        122
      ]
    },
    {
      "slug": "fate-grand-order-camelot",
      "title": "Fate/Grand Order THE MOVIE: Divine Realm of the Round Table -Camelot- Wandering; Agateram",
      "short": "Camelot",
      "kind": "film",
      "released": "2020-12-05",
      "chronology": 130,
      "sagaId": "saga-grand-order-babylonia",
      "required": false,
      "unit": "Min.",
      "range": [
        0,
        89
      ]
    }
  ],
  "arcs": [
    {
      "id": "stay-night-fate-route",
      "workSlug": "fate-stay-night-2006",
      "name": "Der Fate-Pfad: Shirous erster Gralkrieg",
      "tone": "arc-1"
    },
    {
      "id": "zero-fourth-war",
      "workSlug": "fate-zero",
      "name": "Der Vierte Heilige Gralkrieg",
      "tone": "arc-2"
    },
    {
      "id": "proto-tokyo-1991",
      "workSlug": "fate-prototype",
      "name": "Erster Tokio Gralkrieg (1991)",
      "tone": "neutral"
    },
    {
      "id": "prisma-illya-transformation",
      "workSlug": "fate-kaleid-liner-prisma-illya",
      "name": "Illyas Verwandlung zur Kaleidscope-Kriegerin",
      "tone": "arc-1"
    },
    {
      "id": "ubw-route",
      "workSlug": "fate-stay-night-unlimited-blade-works",
      "name": "Der UBW-Pfad: Rins Route und Archer",
      "tone": "arc-1"
    },
    {
      "id": "apocrypha-great-war",
      "workSlug": "fate-apocrypha",
      "name": "Schwarze und Rote Fraktion im Großen Gralkrieg",
      "tone": "neutral"
    },
    {
      "id": "prisma-oath-shirou",
      "workSlug": "fate-kaleid-liner-prisma-illya-oath-under-snow",
      "name": "Shirous Gralkrieg in der sterbenden Welt",
      "tone": "arc-1"
    },
    {
      "id": "hf-1-shadow",
      "workSlug": "fate-heavens-feel-1-presage-flower",
      "name": "Sakuras Schatten erwacht",
      "tone": "arc-1"
    },
    {
      "id": "fgo-lostbelt-prologue",
      "workSlug": "fate-grand-order-moonlight-lostroom",
      "name": "Schatten der ausgelöschten Zukunft",
      "tone": "arc-3"
    },
    {
      "id": "gohan-alltag",
      "workSlug": "todays-menu-for-the-emiya-family",
      "name": "Emiya-Haushalt Kochalltag",
      "tone": "neutral"
    },
    {
      "id": "hf-2-corruption",
      "workSlug": "fate-heavens-feel-2-lost-butterfly",
      "name": "Der Fall in die Verderbnis",
      "tone": "arc-1"
    },
    {
      "id": "babylonia-singularity",
      "workSlug": "fate-grand-order-babylonia",
      "name": "Die erste Singularität: Uruk",
      "tone": "arc-3"
    },
    {
      "id": "hf-3-finale",
      "workSlug": "fate-heavens-feel-3-spring-song",
      "name": "Das letzte Gefecht um Sakura",
      "tone": "arc-1"
    },
    {
      "id": "camelot-round-table",
      "workSlug": "fate-grand-order-camelot",
      "name": "Der Runde Tisch von Camelot",
      "tone": "arc-3"
    }
  ],
  "characters": [
    {
      "id": "shirou-emiya-fsn",
      "workSlug": "fate-stay-night-2006",
      "name": "Shirou Emiya",
      "initials": "SE"
    },
    {
      "id": "kiritsugu-emiya",
      "workSlug": "fate-zero",
      "name": "Kiritsugu Emiya",
      "initials": "KE"
    },
    {
      "id": "arthur-pendragon-proto",
      "workSlug": "fate-prototype",
      "name": "Saber (Arthur Pendragon Prototype)",
      "initials": "AP"
    },
    {
      "id": "illya-kaleid",
      "workSlug": "fate-kaleid-liner-prisma-illya",
      "name": "Illyasviel von Einzbern",
      "initials": "IE"
    },
    {
      "id": "rin-tohsaka",
      "workSlug": "fate-stay-night-unlimited-blade-works",
      "name": "Rin Tohsaka",
      "initials": "RT"
    },
    {
      "id": "sieg-apocrypha",
      "workSlug": "fate-apocrypha",
      "name": "Sieg",
      "initials": "SI"
    },
    {
      "id": "miyu-edelfelt-oath",
      "workSlug": "fate-kaleid-liner-prisma-illya-oath-under-snow",
      "name": "Miyu Edelfelt",
      "initials": "ME"
    },
    {
      "id": "sakura-matou-hf",
      "workSlug": "fate-heavens-feel-1-presage-flower",
      "name": "Sakura Matou",
      "initials": "SM"
    },
    {
      "id": "ritsuka-fujimaru",
      "workSlug": "fate-grand-order-moonlight-lostroom",
      "name": "Ritsuka Fujimaru",
      "initials": "RF"
    },
    {
      "id": "shirou-emiya-gohan",
      "workSlug": "todays-menu-for-the-emiya-family",
      "name": "Shirou Emiya",
      "initials": "SE"
    },
    {
      "id": "shirou-emiya-hf",
      "workSlug": "fate-heavens-feel-2-lost-butterfly",
      "name": "Shirou Emiya",
      "initials": "SE"
    },
    {